row_id,PET_id,PET,expanded_text,span_text,label,whole_text,pet_type
907,51,冷たくなる,いたり、なかなか勇気の出ない自分に情けなさを感じているかもしれません。なぜ男性が[PET_BOUNDARY]冷たくなって[PET_BOUNDARY]いくのか、なぜ自分ばかりが一生懸命なのか、どうすれば恋愛はうまくいくのか、「？,冷たくなって,0,いたり、なかなか勇気の出ない自分に情けなさを感じているかもしれません。なぜ男性が冷たくなっていくのか、なぜ自分ばかりが一生懸命なのか、どうすれば恋愛はうまくいくのか、「？,sometimes
908,51,冷たくなる,職場で気になっている人が、最近急に僕に[PET_BOUNDARY]冷たくなった[PET_BOUNDARY]ような気がします。彼女に僕が好意を持っていることを気づかれて、警戒されたのでし,冷たくなった,0,職場で気になっている人が、最近急に僕に冷たくなったような気がします。彼女に僕が好意を持っていることを気づかれて、警戒されたのでし,sometimes
909,51,冷たくなる,なく、「クマの痕跡」をさがしに…。 外は晴れていますが、午後になって、かなり風が[PET_BOUNDARY]冷たくなって[PET_BOUNDARY]きました。寒がりやのわたしは、出発前にこっそりホカロンを腰にはりつけました。,冷たくなって,0,なく、「クマの痕跡」をさがしに…。 外は晴れていますが、午後になって、かなり風が冷たくなってきました。寒がりやのわたしは、出発前にこっそりホカロンを腰にはりつけました。,sometimes
910,51,冷たくなる,ダ油、酢、にんにくみじん、塩、胡椒、豆板醬を混ぜたもの）であえて冷蔵庫に入れる。[PET_BOUNDARY]冷たくなって[PET_BOUNDARY]味がなじんでおいしくなる。たこは塩でもんでおくと味がよくしみる。 たこステーキ,冷たくなって,0,ダ油、酢、にんにくみじん、塩、胡椒、豆板醬を混ぜたもの）であえて冷蔵庫に入れる。冷たくなって味がなじんでおいしくなる。たこは塩でもんでおくと味がよくしみる。 たこステーキ,sometimes
911,51,冷たくなる,けられるしブレーキ握れるし、、、ホッとするね。それにしても、めっきり朝晩の空気が[PET_BOUNDARY]冷たくなって[PET_BOUNDARY]きたなぁ。。。,冷たくなって,0,けられるしブレーキ握れるし、、、ホッとするね。それにしても、めっきり朝晩の空気が冷たくなってきたなぁ。。。,sometimes
912,51,冷たくなる,ころがりこんでくるだろう。だが、彼はまず体を洗うことにした。お湯はすでにほとんど[PET_BOUNDARY]冷たくなって[PET_BOUNDARY]いたが、それでも最高だった！ それからベッドに清潔なシーツを敷いた。だがベッド,冷たくなって,0,ころがりこんでくるだろう。だが、彼はまず体を洗うことにした。お湯はすでにほとんど冷たくなっていたが、それでも最高だった！ それからベッドに清潔なシーツを敷いた。だがベッド,sometimes
913,51,冷たくなる,年１１月２５日（火）今日は 昨日の雨があがって青空♪３時を過ぎるとそろそろ 風も[PET_BOUNDARY]冷たくなって[PET_BOUNDARY] 陽も傾きはじめます、、、寒くなると 縮こまっているせいか？肩凝り＆首が凝る？,冷たくなって,0,年１１月２５日（火）今日は 昨日の雨があがって青空♪３時を過ぎるとそろそろ 風も冷たくなって 陽も傾きはじめます、、、寒くなると 縮こまっているせいか？肩凝り＆首が凝る？,sometimes
914,51,冷たくなる,ある。 いまの日本人にはまずそのやさしさが欠けているのである。これは日本人の心が[PET_BOUNDARY]冷たくなった[PET_BOUNDARY]わけではないと思いたい。社会的訓練や習慣の問題に起因すると信じたい。もし心の問,冷たくなった,0,ある。 いまの日本人にはまずそのやさしさが欠けているのである。これは日本人の心が冷たくなったわけではないと思いたい。社会的訓練や習慣の問題に起因すると信じたい。もし心の問,sometimes
915,51,冷たくなる,開けようとすると、重い扉がびくともしない、鍵がかかっている、そのときの、体の中が[PET_BOUNDARY]冷たくなって[PET_BOUNDARY]しまうような感じを今でも覚えている、という。家庭内で父親が弟にたいして怒るとき,冷たくなって,0,開けようとすると、重い扉がびくともしない、鍵がかかっている、そのときの、体の中が冷たくなってしまうような感じを今でも覚えている、という。家庭内で父親が弟にたいして怒るとき,sometimes
916,51,冷たくなる,いないし、同居人もいない。ジャンカルロは心のなかでゆっくり繰り返した。突然、体が[PET_BOUNDARY]冷たくなった[PET_BOUNDARY]。ロンドンの地価の高さなら知っている。しかも瀟洒なチェルシー地区だ。一介の秘書,冷たくなった,0,いないし、同居人もいない。ジャンカルロは心のなかでゆっくり繰り返した。突然、体が冷たくなった。ロンドンの地価の高さなら知っている。しかも瀟洒なチェルシー地区だ。一介の秘書,sometimes
917,51,冷たくなる,です。たまにある失敗は「揚げすぎて肉が硬くなっている」か「揚げてから時間がたって[PET_BOUNDARY]冷たくなって[PET_BOUNDARY]しまっている」か、それらの合わせ技っていうことぐらいでしょうか。 胸肉よりもモ,冷たくなって,0,です。たまにある失敗は「揚げすぎて肉が硬くなっている」か「揚げてから時間がたって冷たくなってしまっている」か、それらの合わせ技っていうことぐらいでしょうか。 胸肉よりもモ,sometimes
918,51,冷たくなる,てことだ。ジェシカにそんなことを言われると、パニックが押しよせてきて、頭のなかが[PET_BOUNDARY]冷たくなって[PET_BOUNDARY]くるくるまわりだしたような気分になった。彼女の言い分が正しいと考える人だってい,冷たくなって,0,てことだ。ジェシカにそんなことを言われると、パニックが押しよせてきて、頭のなかが冷たくなってくるくるまわりだしたような気分になった。彼女の言い分が正しいと考える人だってい,sometimes
919,51,冷たくなる,はさほど遠くない。 もう少しで炭櫃の火に当たれるだろう。桂の差し出す白湯の器で、[PET_BOUNDARY]冷たくなった[PET_BOUNDARY]指先を温めることができるだろう。 遠くで、寂しげな犬の遠吠えが響いた。ふと、夏,冷たくなった,0,はさほど遠くない。 もう少しで炭櫃の火に当たれるだろう。桂の差し出す白湯の器で、冷たくなった指先を温めることができるだろう。 遠くで、寂しげな犬の遠吠えが響いた。ふと、夏,sometimes
920,51,冷たくなる,上の接点がなく、どうすればいいかわからないままうじうじしていたら彼のほうが以上に[PET_BOUNDARY]冷たくなって[PET_BOUNDARY]しまった。そんな状況のとき、どうすればいい？職場だしいろいろあるよね・・・。,冷たくなって,0,上の接点がなく、どうすればいいかわからないままうじうじしていたら彼のほうが以上に冷たくなってしまった。そんな状況のとき、どうすればいい？職場だしいろいろあるよね・・・。,sometimes
921,51,冷たくなる,。まるで遥か彼方の記憶のように、ようやく、そんなことを思い出す。 「はい。これで[PET_BOUNDARY]冷たくなって[PET_BOUNDARY]くるから。さっきのタオルでくるんで」 実は加恵子の方が、傷はよほどひどかった。,冷たくなって,0,。まるで遥か彼方の記憶のように、ようやく、そんなことを思い出す。 「はい。これで冷たくなってくるから。さっきのタオルでくるんで」 実は加恵子の方が、傷はよほどひどかった。,sometimes
922,51,冷たくなる,げ、彼の目を見すえて言った。「あなたはわたしよりもずっと強いもの」 ニックの瞳が[PET_BOUNDARY]冷たくなった[PET_BOUNDARY]。「僕が力ずくで女性をものにする人間だと思っているのか？」 そんな人だとは思え,冷たくなった,0,げ、彼の目を見すえて言った。「あなたはわたしよりもずっと強いもの」 ニックの瞳が冷たくなった。「僕が力ずくで女性をものにする人間だと思っているのか？」 そんな人だとは思え,sometimes
923,51,冷たくなる,言った。 「ただし、この息子の成績が上がらないようなら」マルフォイ氏の声が一段と[PET_BOUNDARY]冷たくなった[PET_BOUNDARY]。 「行き着く先は、せいぜいそんなところかもしれん」 「僕の責任じゃない」ドラ,冷たくなった,0,言った。 「ただし、この息子の成績が上がらないようなら」マルフォイ氏の声が一段と冷たくなった。 「行き着く先は、せいぜいそんなところかもしれん」 「僕の責任じゃない」ドラ,sometimes
993,58,眠りにつく,とにかく忙しいですものねぇ。で、いろいろ調べました、が、まず人間は、誰でも前夜に[PET_BOUNDARY]眠りについてから[PET_BOUNDARY]、１５時間後に、一度目の軽い眠気がくるそうです。夜１２時に寝たら、翌日の,眠りについてから,0,とにかく忙しいですものねぇ。で、いろいろ調べました、が、まず人間は、誰でも前夜に眠りについてから、１５時間後に、一度目の軽い眠気がくるそうです。夜１２時に寝たら、翌日の,sometimes
994,58,眠りにつく,養剤の準備も忘れられない。翌朝の迎え酒ならぬ「迎えスープ」もなおざりにできない。[PET_BOUNDARY]眠りにつくのは[PET_BOUNDARY]一二時過ぎてからのことであろう。 全国の五五〇万にものぼる専業主婦は、以上,眠りにつくのは,0,養剤の準備も忘れられない。翌朝の迎え酒ならぬ「迎えスープ」もなおざりにできない。眠りにつくのは一二時過ぎてからのことであろう。 全国の五五〇万にものぼる専業主婦は、以上,sometimes
995,58,眠りにつく,オーズとやらの声は緊張しきっていた。 部屋からはもう歌声は聞こえてこない。老人は[PET_BOUNDARY]眠りについたのだろう[PET_BOUNDARY]。火がはぜる暖炉のそばで、柔らかい毛布を膝にかけ、椅子にもたれて目を,眠りについたのだろう,0,オーズとやらの声は緊張しきっていた。 部屋からはもう歌声は聞こえてこない。老人は眠りについたのだろう。火がはぜる暖炉のそばで、柔らかい毛布を膝にかけ、椅子にもたれて目を,sometimes
996,58,眠りにつく,してくることがあった。達郎はよく、音の源の具体像をひとつひとつイメージしながら、[PET_BOUNDARY]眠りについた[PET_BOUNDARY]ものだ。 建物の背後に回り込んだとき、達郎が見たものは、予期した通り、イメー,眠りについた,0,してくることがあった。達郎はよく、音の源の具体像をひとつひとつイメージしながら、眠りについたものだ。 建物の背後に回り込んだとき、達郎が見たものは、予期した通り、イメー,sometimes
997,58,眠りにつく,味をビジネスに出来るなんて・・・大変かもしれないけど、羨ましいです。我が家で深い[PET_BOUNDARY]眠りについて[PET_BOUNDARY]いる「データカードダス」など協力できる物もあるかもしれません。かなりしばらく,眠りについて,0,味をビジネスに出来るなんて・・・大変かもしれないけど、羨ましいです。我が家で深い眠りについている「データカードダス」など協力できる物もあるかもしれません。かなりしばらく,sometimes
998,58,眠りにつく,キャンプへも、もちろんトランペットと一緒ですわ。 昼間の練習で疲れて、選手が[PET_BOUNDARY]眠りにつこうと[PET_BOUNDARY]する頃、突然、雑音ともつかぬ奇妙な音が宿舎に響き渡るんやて。プー、プー、プ,眠りにつこうと,0,キャンプへも、もちろんトランペットと一緒ですわ。 昼間の練習で疲れて、選手が眠りにつこうとする頃、突然、雑音ともつかぬ奇妙な音が宿舎に響き渡るんやて。プー、プー、プ,sometimes
999,58,眠りにつく,文を書かなくなった。明日こそは、といつも思いながら、結局は筆をとることなく毎晩[PET_BOUNDARY]眠りについた[PET_BOUNDARY]。 しかし今日は、ようやく返事を書くことができそうだった。「お琴。私には、ふ,眠りについた,0,文を書かなくなった。明日こそは、といつも思いながら、結局は筆をとることなく毎晩眠りについた。 しかし今日は、ようやく返事を書くことができそうだった。「お琴。私には、ふ,sometimes
1000,58,眠りにつく,り、仮眠したりしました。 一対一に弟子訓練の予習をして帰る。 ＴＶを観てるうちに[PET_BOUNDARY]眠りにつく[PET_BOUNDARY]。 今日一日が祝福されて恵まれて感謝です。 パップスクラブのホームページ ｈｔ,眠りにつく,0,り、仮眠したりしました。 一対一に弟子訓練の予習をして帰る。 ＴＶを観てるうちに眠りにつく。 今日一日が祝福されて恵まれて感謝です。 パップスクラブのホームページ ｈｔ,sometimes
1001,58,眠りにつく,をひそめるようにしていった。 「睡眠薬？」 「といっても、ベンザリン系統の薬で、[PET_BOUNDARY]眠りにつく[PET_BOUNDARY]ためのものなんだ。加納さんは二錠飲んで、残りの八錠はケースに入ったまま、スーツ,眠りにつく,0,をひそめるようにしていった。 「睡眠薬？」 「といっても、ベンザリン系統の薬で、眠りにつくためのものなんだ。加納さんは二錠飲んで、残りの八錠はケースに入ったまま、スーツ,sometimes
1002,58,眠りにつく,女の子をだまし、薬局からモルヒネ錠を盗み出させる。もう目覚めることはあるまい、と[PET_BOUNDARY]眠りについたのだったが[PET_BOUNDARY]、なんと次の日、ぱっちりとお目覚め。少女は再び薬局の高い戸棚によじ,眠りについたのだったが,0,女の子をだまし、薬局からモルヒネ錠を盗み出させる。もう目覚めることはあるまい、と眠りについたのだったが、なんと次の日、ぱっちりとお目覚め。少女は再び薬局の高い戸棚によじ,sometimes
1003,58,眠りにつく,見ながら歌を詠んだ。やがて月も入り、大路のゆききも絶えて静かになったので、正興も[PET_BOUNDARY]眠りについた[PET_BOUNDARY]。 翌七日、正興は暁の鐘におどろき、目を覚ます。朝の飯を食べ、宿に別れを告げ,眠りについた,0,見ながら歌を詠んだ。やがて月も入り、大路のゆききも絶えて静かになったので、正興も眠りについた。 翌七日、正興は暁の鐘におどろき、目を覚ます。朝の飯を食べ、宿に別れを告げ,sometimes
1004,58,眠りにつく,らしいですわ。 スヤスヤと、試合でファインプレーでもした夢に酔いながら、心地よい[PET_BOUNDARY]眠りについて[PET_BOUNDARY]いたある晩の土井、 「ギャー！」 突然悲鳴をあげた。誰かが腹を踏みつけたんや,眠りについて,0,らしいですわ。 スヤスヤと、試合でファインプレーでもした夢に酔いながら、心地よい眠りについていたある晩の土井、 「ギャー！」 突然悲鳴をあげた。誰かが腹を踏みつけたんや,sometimes
1005,58,眠りにつく,んとじゃけん。 原田の子供も二回か三回おろした。あの子らを産んでいれば…。セツは[PET_BOUNDARY]眠りについた[PET_BOUNDARY]。眠ることだけがセツは一番楽しみになっていた。そばがらの枕は、いつしか邯鄲の,眠りについた,0,んとじゃけん。 原田の子供も二回か三回おろした。あの子らを産んでいれば…。セツは眠りについた。眠ることだけがセツは一番楽しみになっていた。そばがらの枕は、いつしか邯鄲の,sometimes
1006,58,眠りにつく,は長剣を腰から抜くと階を上がった。回廊の端に回り、長船兼光を抱えこむように座すと[PET_BOUNDARY]眠りについた[PET_BOUNDARY]。 死者の霊魂が彷徨う刑場の一角の回向院に寄りつく人はさほどいない。 一松に,眠りについた,0,は長剣を腰から抜くと階を上がった。回廊の端に回り、長船兼光を抱えこむように座すと眠りについた。 死者の霊魂が彷徨う刑場の一角の回向院に寄りつく人はさほどいない。 一松に,sometimes
1007,58,眠りにつく,室に入ってきて、何度も何度もセツを起こした。文子が長男と外出していた時のことだ。[PET_BOUNDARY]眠りにつこうと[PET_BOUNDARY]しているセツに、 「姉さん、姉さん、私はどこにおるん。ここはどこ？」とゆり,眠りにつこうと,0,室に入ってきて、何度も何度もセツを起こした。文子が長男と外出していた時のことだ。眠りにつこうとしているセツに、 「姉さん、姉さん、私はどこにおるん。ここはどこ？」とゆり,sometimes
1008,58,眠りにつく,覚め、何となく時計に目をやると午後六時を回っていた。ストライキ突入を決定した後、[PET_BOUNDARY]眠りについたのは[PET_BOUNDARY]日が昇る直前だった。古田敦也選手会長（ヤクルト）の疲労は極限に達していた,眠りについたのは,0,覚め、何となく時計に目をやると午後六時を回っていた。ストライキ突入を決定した後、眠りについたのは日が昇る直前だった。古田敦也選手会長（ヤクルト）の疲労は極限に達していた,sometimes
1009,58,眠りにつく,ニクル読み終わった。今日の朝、７時１５分に終わった。昨日、残り６０ページを残して[PET_BOUNDARY]眠りについた[PET_BOUNDARY]。そして、今日は新聞配達が終わったあと、１時間かけて読んだ。あぁ。まあ、結構,眠りについた,0,ニクル読み終わった。今日の朝、７時１５分に終わった。昨日、残り６０ページを残して眠りについた。そして、今日は新聞配達が終わったあと、１時間かけて読んだ。あぁ。まあ、結構,sometimes
1010,58,眠りにつく,気分も“下がってくる”気がするんですよ（笑）。 一日の終わり。満ち足りた気持ちで[PET_BOUNDARY]眠りにつく[PET_BOUNDARY]時間は、心から幸せ。 そんな日々からにじみ出る美しさを積極的に求めていきたい私,眠りにつく,0,気分も“下がってくる”気がするんですよ（笑）。 一日の終わり。満ち足りた気持ちで眠りにつく時間は、心から幸せ。 そんな日々からにじみ出る美しさを積極的に求めていきたい私,sometimes
1011,58,眠りにつく,西洋・ニューファンドランド島沖で氷山に衝突。多くの人々の夢を乗せたまま，海底深く[PET_BOUNDARY]眠りにつく[PET_BOUNDARY]ことになった。Ｑｕｅｓｔｉｏｎ１）地図帳で，サウサンプトンとニューヨークの位置,眠りにつく,1,西洋・ニューファンドランド島沖で氷山に衝突。多くの人々の夢を乗せたまま，海底深く眠りにつくことになった。Ｑｕｅｓｔｉｏｎ１）地図帳で，サウサンプトンとニューヨークの位置,sometimes
1012,58,眠りにつく,アウトにも気をつけています。午前中の９〜１０時、忙しい朝が一段落し、子どもがまた[PET_BOUNDARY]眠りにつく[PET_BOUNDARY]時間が私のパソコンタイム。好きなＢ’ｚや編み物のコンテンツもあるので、いろんな,眠りにつく,0,アウトにも気をつけています。午前中の９〜１０時、忙しい朝が一段落し、子どもがまた眠りにつく時間が私のパソコンタイム。好きなＢ’ｚや編み物のコンテンツもあるので、いろんな,sometimes
1013,58,眠りにつく,オレはリサの横に寝転んで 暫くリサの手を握って ヘタな子守唄を歌った。。[PET_BOUNDARY]眠りについたのを[PET_BOUNDARY]確認してから オレは隣の片付いていない部屋で明日の講義の準備をする。用意,眠りについたのを,0,オレはリサの横に寝転んで 暫くリサの手を握って ヘタな子守唄を歌った。。眠りについたのを確認してから オレは隣の片付いていない部屋で明日の講義の準備をする。用意,sometimes
1014,58,眠りにつく,この日もグデングデンになるまで飲んだ。そしてやっとの思いでホテルの部屋に戻り、[PET_BOUNDARY]眠りについた[PET_BOUNDARY]。 翌朝、二日酔いの中で目をさましたが、マリオットの家具はどこも同じ感じで統,眠りについた,0,この日もグデングデンになるまで飲んだ。そしてやっとの思いでホテルの部屋に戻り、眠りについた。 翌朝、二日酔いの中で目をさましたが、マリオットの家具はどこも同じ感じで統,sometimes
1015,58,眠りにつく,なものなんでしょうね。もう一つ寝ることに関して、私はこういう経験が多々あります。[PET_BOUNDARY]眠りについた[PET_BOUNDARY]すぐ、寝るな〜っ！と言っておでこをたたかれ、起こされる。これも誰かに起こされ,眠りについた,0,なものなんでしょうね。もう一つ寝ることに関して、私はこういう経験が多々あります。眠りについたすぐ、寝るな〜っ！と言っておでこをたたかれ、起こされる。これも誰かに起こされ,sometimes
1016,58,眠りにつく,体は疲れが残ります。すると、次に眠る時、体は短時間で修復させようと、自然に深い[PET_BOUNDARY]眠りにつく[PET_BOUNDARY]よう働きます。,眠りにつく,0,体は疲れが残ります。すると、次に眠る時、体は短時間で修復させようと、自然に深い眠りにつくよう働きます。,sometimes
1017,58,眠りにつく,散歩に行ったり水分を取らせても一向に泣き止まず、最後は疲れ果てて[PET_BOUNDARY]眠りにつくと[PET_BOUNDARY]いった感じです。よろしくお願いいたします。うちも寝つきが悪くて困った経験があ,眠りにつくと,0,散歩に行ったり水分を取らせても一向に泣き止まず、最後は疲れ果てて眠りにつくといった感じです。よろしくお願いいたします。うちも寝つきが悪くて困った経験があ,sometimes
1018,58,眠りにつく,みたら自分のベッドの中でした。 これはクリスチャンの死のようです。クリスチャンは[PET_BOUNDARY]眠りについて[PET_BOUNDARY]、天の家で目を覚ますのです。何が怖いんですって？聖霊による喜ばしい解放を感じ,眠りについて,1,みたら自分のベッドの中でした。 これはクリスチャンの死のようです。クリスチャンは眠りについて、天の家で目を覚ますのです。何が怖いんですって？聖霊による喜ばしい解放を感じ,sometimes
1019,58,眠りにつく,出撃命令が下された。秀忠軍は、戦闘がはじまった十四日の夜は、中山道は本山の宿舎で[PET_BOUNDARY]眠りについて[PET_BOUNDARY]いた。 この軍旅で関ヶ原の戦闘に加わることができなかった正三の見たものは何で,眠りについて,0,出撃命令が下された。秀忠軍は、戦闘がはじまった十四日の夜は、中山道は本山の宿舎で眠りについていた。 この軍旅で関ヶ原の戦闘に加わることができなかった正三の見たものは何で,sometimes
1020,58,眠りにつく,ただ、彼の周辺には常に人の気配があった。一室にひとりで在るという事態は、夜、深い[PET_BOUNDARY]眠りについて[PET_BOUNDARY]いる時ですら有り得なかった。 常に灯火の世話をする侍女がひとりと、太医のうち,眠りについて,0,ただ、彼の周辺には常に人の気配があった。一室にひとりで在るという事態は、夜、深い眠りについている時ですら有り得なかった。 常に灯火の世話をする侍女がひとりと、太医のうち,sometimes
