row_id,PET_id,PET,expanded_text,span_text,label,whole_text,pet_type
1213,66,お開き,はるはずのとのさまは、一言もおくちをひらき給はず、つと玉座をおたちになると、扉を[PET_BOUNDARY]お開き[PET_BOUNDARY]あそばされて出ておいでになつて了ひました。そのとき、おとゞの面わはふつとけはしう,お開き,0,はるはずのとのさまは、一言もおくちをひらき給はず、つと玉座をおたちになると、扉をお開きあそばされて出ておいでになつて了ひました。そのとき、おとゞの面わはふつとけはしう,sometimes
1214,66,お開き,最澄さまのことはほとんど知らなかった。それなのに、五十歳を越えて、伝教大師さまが[PET_BOUNDARY]お開きに[PET_BOUNDARY]なった天台宗の尼僧にしていただく運命がわたしにはあったんですね。 わたしは出家,お開きに,0,最澄さまのことはほとんど知らなかった。それなのに、五十歳を越えて、伝教大師さまがお開きになった天台宗の尼僧にしていただく運命がわたしにはあったんですね。 わたしは出家,sometimes
1215,66,お開き,はじめに大村 大崎先生が『大人のピアノ教室』を[PET_BOUNDARY]お開きに[PET_BOUNDARY]なって、もう１２年が経つそうですね。大崎 ええ、そうですが…。先生、何だかいつ,お開きに,0,はじめに大村 大崎先生が『大人のピアノ教室』をお開きになって、もう１２年が経つそうですね。大崎 ええ、そうですが…。先生、何だかいつ,sometimes
1216,66,お開き,生徒らの白い眼であった。彼らはやはり凶徒のごとくあつかわれたのである。鹿児島県の[PET_BOUNDARY]お開きの[PET_BOUNDARY]とき、布教の先頭にたったのは大津鉄然、暉岡普瑞、山崎照夫、香川黙識ら、のちに東,お開きの,0,生徒らの白い眼であった。彼らはやはり凶徒のごとくあつかわれたのである。鹿児島県のお開きのとき、布教の先頭にたったのは大津鉄然、暉岡普瑞、山崎照夫、香川黙識ら、のちに東,sometimes
1217,66,お開き,を図ることといたしております。以下、一ページ飛ばしていただきまして、十三ページを[PET_BOUNDARY]お開き[PET_BOUNDARY]いただきたいと思います。十三ページは、第五の主要事項の心身障害者等特別の配慮を要,お開き,0,を図ることといたしております。以下、一ページ飛ばしていただきまして、十三ページをお開きいただきたいと思います。十三ページは、第五の主要事項の心身障害者等特別の配慮を要,sometimes
1218,66,お開き,設労働職業訓練センターを二カ所新設いたすことといたしております。次は十五ページを[PET_BOUNDARY]お開き[PET_BOUNDARY]いただきまして、十五ページの３では季節・出かせぎ労働者対策の推進でございます。こ,お開き,0,設労働職業訓練センターを二カ所新設いたすことといたしております。次は十五ページをお開きいただきまして、十五ページの３では季節・出かせぎ労働者対策の推進でございます。こ,sometimes
1219,66,お開き,企業集団に対する指導、助成の推進等を従来どおり計上いたしております。十九ページを[PET_BOUNDARY]お開き[PET_BOUNDARY]いただきまして、十九ページは、第八の主要事項の労働外交関係でございます。ここでは,お開き,0,企業集団に対する指導、助成の推進等を従来どおり計上いたしております。十九ページをお開きいただきまして、十九ページは、第八の主要事項の労働外交関係でございます。ここでは,sometimes
1220,66,お開き,たのでしょうか。 何でも聞くところによれば、堪忍の上に堪忍を重ねて、ついに天下を[PET_BOUNDARY]お開きに[PET_BOUNDARY]なった辛抱強いご気性であったとか。 しかし堪忍だの辛抱だのというものは、重ぬれ,お開きに,0,たのでしょうか。 何でも聞くところによれば、堪忍の上に堪忍を重ねて、ついに天下をお開きになった辛抱強いご気性であったとか。 しかし堪忍だの辛抱だのというものは、重ぬれ,sometimes
1221,66,お開き,過ごしとのこと、心からお喜び申し上げます。 このたびは喜寿を記念されて、作品展を[PET_BOUNDARY]お開きに[PET_BOUNDARY]なりますとのこと、重ねがさね、おめでとうございます。 先生に刺繡をご指導いただ,お開きに,0,過ごしとのこと、心からお喜び申し上げます。 このたびは喜寿を記念されて、作品展をお開きになりますとのこと、重ねがさね、おめでとうございます。 先生に刺繡をご指導いただ,sometimes
1222,66,お開き,増となっております。以下、主要事項につきまして概要を御説明申し上げます。二枚目を[PET_BOUNDARY]お開き[PET_BOUNDARY]いただきまして、主要事項は大きく九つの事項に分けてございます。まず第一の事項は、,お開き,0,増となっております。以下、主要事項につきまして概要を御説明申し上げます。二枚目をお開きいただきまして、主要事項は大きく九つの事項に分けてございます。まず第一の事項は、,sometimes
1308,73,繊細,すか？ぜひ意見を聞かせて下さい。そういうことは、よくあることです。あなたが素直な[PET_BOUNDARY]繊細な[PET_BOUNDARY]人だから、当然のことでしょう。確か寺山修治の作品にも、絵に描いた女性に恋をする,繊細な,1,すか？ぜひ意見を聞かせて下さい。そういうことは、よくあることです。あなたが素直な繊細な人だから、当然のことでしょう。確か寺山修治の作品にも、絵に描いた女性に恋をする,sometimes
1309,73,繊細,する根深い嫌悪感が彼にはあったように思う。 乱暴ではあるけれど、それが、シャイで[PET_BOUNDARY]繊細な[PET_BOUNDARY]神経からきていることは、付き合ううちによくわかった。 やがて僕は、彼のすすめで,繊細な,1,する根深い嫌悪感が彼にはあったように思う。 乱暴ではあるけれど、それが、シャイで繊細な神経からきていることは、付き合ううちによくわかった。 やがて僕は、彼のすすめで,sometimes
1310,73,繊細,精神的なしがらみからくるものだと知るラッセルは、微妙に言葉を濁す。 お気の毒に、[PET_BOUNDARY]繊細[PET_BOUNDARY]そうな方だから…、とひとしきり同情すると、婦人は階下に降りていった。 毎朝、婦人,繊細,1,精神的なしがらみからくるものだと知るラッセルは、微妙に言葉を濁す。 お気の毒に、繊細そうな方だから…、とひとしきり同情すると、婦人は階下に降りていった。 毎朝、婦人,sometimes
1311,73,繊細,うので、彼女のおにいさんは、グンドラは「わめいている」といいます。彼女は心も体も[PET_BOUNDARY]繊細な[PET_BOUNDARY]子どもで、綿密な注意と愛情に満ちた理解が必要です。憂鬱質の子どもの扱い方 憂鬱,繊細な,1,うので、彼女のおにいさんは、グンドラは「わめいている」といいます。彼女は心も体も繊細な子どもで、綿密な注意と愛情に満ちた理解が必要です。憂鬱質の子どもの扱い方 憂鬱,sometimes
1312,73,繊細,えてしまっていて、それに彼女自身が気づいてなかったのかもしれません。 女性は大変[PET_BOUNDARY]繊細で[PET_BOUNDARY]直感力が強いので、善くも悪くも、職場全体の雰囲気が個人に、または個人のエネルギ,繊細で,1,えてしまっていて、それに彼女自身が気づいてなかったのかもしれません。 女性は大変繊細で直感力が強いので、善くも悪くも、職場全体の雰囲気が個人に、または個人のエネルギ,sometimes
1313,73,繊細,しば起きるかも知れませんよ。それでも好きなら黙って支えてあげましょう。彼はとても[PET_BOUNDARY]繊細な[PET_BOUNDARY]人なのだと思います。彼の性格は変りませんよ？貴方が疲れたら別れ時です。,繊細な,1,しば起きるかも知れませんよ。それでも好きなら黙って支えてあげましょう。彼はとても繊細な人なのだと思います。彼の性格は変りませんよ？貴方が疲れたら別れ時です。,sometimes
1314,73,繊細,、「血の気の少ない人」。体温が低いから、たいてい青白い顔をしています。ナイーブで[PET_BOUNDARY]繊細[PET_BOUNDARY]、神経質で、まわりの目を気にしがち。 風邪を引くといつまでも長引いたり、季節の変,繊細,1,、「血の気の少ない人」。体温が低いから、たいてい青白い顔をしています。ナイーブで繊細、神経質で、まわりの目を気にしがち。 風邪を引くといつまでも長引いたり、季節の変,sometimes
1315,73,繊細,か…。 「ひょっとして圭祐くん、この結婚に反対だったのかもしれない…」 「そんな[PET_BOUNDARY]繊細な[PET_BOUNDARY]人じゃないよ」 時期的にはあってるかもしれないけど、そんなことに煩わされるタイ,繊細な,1,か…。 「ひょっとして圭祐くん、この結婚に反対だったのかもしれない…」 「そんな繊細な人じゃないよ」 時期的にはあってるかもしれないけど、そんなことに煩わされるタイ,sometimes
1316,73,繊細,軟弱なんだから！」 昴が偉そうに言うと、祖母のゆず子は首を振った。 「諒ちゃんは[PET_BOUNDARY]繊細なのよ[PET_BOUNDARY]。だから体だけじゃなく、精神的にもきっとまいってしまっているのよ」 「ええ,繊細なのよ,1,軟弱なんだから！」 昴が偉そうに言うと、祖母のゆず子は首を振った。 「諒ちゃんは繊細なのよ。だから体だけじゃなく、精神的にもきっとまいってしまっているのよ」 「ええ,sometimes
1317,73,繊細,矛盾した存在になること、日によってつぎつぎにいじのわるい人間、感情にもろい人間、[PET_BOUNDARY]繊細な[PET_BOUNDARY]人間、野卑な人間、無欲な人間、野心的な人間になることをなげかないようなものなの,繊細な,1,矛盾した存在になること、日によってつぎつぎにいじのわるい人間、感情にもろい人間、繊細な人間、野卑な人間、無欲な人間、野心的な人間になることをなげかないようなものなの,sometimes
1318,73,繊細,とえその動機が宗教的なものである場合でも、その細かい出来栄え―巧みなタッチ、線の[PET_BOUNDARY]繊細さや[PET_BOUNDARY]大胆さ、色の選択―は、神話にふさわしいかどうかばかりでなく、審美的な判断にも,繊細さや,0,とえその動機が宗教的なものである場合でも、その細かい出来栄え―巧みなタッチ、線の繊細さや大胆さ、色の選択―は、神話にふさわしいかどうかばかりでなく、審美的な判断にも,sometimes
1319,73,繊細,ボンで絞ってあるから、ネックラインにボリュームがでるんです￥６９００／クーデター[PET_BOUNDARY]繊細な[PET_BOUNDARY]レースがついてるボートネック。首元はシンプルアクセをつけて￥８９００／アナザー,繊細な,0,ボンで絞ってあるから、ネックラインにボリュームがでるんです￥６９００／クーデター繊細なレースがついてるボートネック。首元はシンプルアクセをつけて￥８９００／アナザー,sometimes
1320,73,繊細,７―「保護対策」ということばはペトルマンだけでなく、読者たちをもぞっとさせる。[PET_BOUNDARY]繊細で[PET_BOUNDARY]慈愛に満ちたペトルマンは先の引用に見られる思想のふくみについてはあえて論議しな,繊細で,0,７―「保護対策」ということばはペトルマンだけでなく、読者たちをもぞっとさせる。繊細で慈愛に満ちたペトルマンは先の引用に見られる思想のふくみについてはあえて論議しな,sometimes
1321,73,繊細,にもなにかできるでしょうか」と、素朴な思いで神戸にやってきた若者たちのなかには、[PET_BOUNDARY]繊細で[PET_BOUNDARY]心やさしい子たちが多かった。都会の核家族で育ち、お年寄りと接したこともあまりな,繊細で,0,にもなにかできるでしょうか」と、素朴な思いで神戸にやってきた若者たちのなかには、繊細で心やさしい子たちが多かった。都会の核家族で育ち、お年寄りと接したこともあまりな,sometimes
1322,73,繊細,シアやローマの円柱のようなエンタシス（中央部のふくらみ）をもたず、ほっそりとした[PET_BOUNDARY]繊細さを[PET_BOUNDARY]感じさせる円柱だ。イスラムの列柱はコルドバのモスクにも見られるが、「獅子の中,繊細さを,0,シアやローマの円柱のようなエンタシス（中央部のふくらみ）をもたず、ほっそりとした繊細さを感じさせる円柱だ。イスラムの列柱はコルドバのモスクにも見られるが、「獅子の中,sometimes
1323,73,繊細,れを眺めた。観光地なんかでよく売っている絵葉書だ。左半分にはＴ県の有名な寺の絵が[PET_BOUNDARY]繊細な[PET_BOUNDARY]タッチで描かれていた。歴史的建築物に何の興味のない私でも目を引かれてしまう。つ,繊細な,0,れを眺めた。観光地なんかでよく売っている絵葉書だ。左半分にはＴ県の有名な寺の絵が繊細なタッチで描かれていた。歴史的建築物に何の興味のない私でも目を引かれてしまう。つ,sometimes
1324,73,繊細,のは格式のあるディナーよりお茶のテーブルに用いられます。パステル系のクロスに白の[PET_BOUNDARY]繊細な[PET_BOUNDARY]レースをかけるとロマンティックです。ワイン色やモスグリーンなどにアイボリーのさ,繊細な,0,のは格式のあるディナーよりお茶のテーブルに用いられます。パステル系のクロスに白の繊細なレースをかけるとロマンティックです。ワイン色やモスグリーンなどにアイボリーのさ,sometimes
1325,73,繊細,家庭に瓶詰めのコーヒーが常備されることに。 そのネスカフェから、味や香りがわかる[PET_BOUNDARY]繊細な[PET_BOUNDARY]日本人の嗜好に向けて、「ネスカフェ 香味焙煎」が発売されています。上質のコーヒ,繊細な,0,家庭に瓶詰めのコーヒーが常備されることに。 そのネスカフェから、味や香りがわかる繊細な日本人の嗜好に向けて、「ネスカフェ 香味焙煎」が発売されています。上質のコーヒ,sometimes
1326,73,繊細,ダンパーの値段はいいのとフツーのでゼロが２個、つまり数十倍違ったりする。そんだけ[PET_BOUNDARY]繊細な[PET_BOUNDARY]部品だから、差は出るんじゃない」タツノ 「それは、どんな風に差が出るんでしょう,繊細な,0,ダンパーの値段はいいのとフツーのでゼロが２個、つまり数十倍違ったりする。そんだけ繊細な部品だから、差は出るんじゃない」タツノ 「それは、どんな風に差が出るんでしょう,sometimes
1497,85,夜のお仕事,せんか」 「いいんですよ」 蓮月はニコニコ笑いながらこういった。 「幾松さんは、[PET_BOUNDARY]夜のお仕事が[PET_BOUNDARY]忙しいでしょう。ですから昼間はゆっくり寝ています。それに幾松さんの後もう一ヵ所,夜のお仕事が,0,せんか」 「いいんですよ」 蓮月はニコニコ笑いながらこういった。 「幾松さんは、夜のお仕事が忙しいでしょう。ですから昼間はゆっくり寝ています。それに幾松さんの後もう一ヵ所,sometimes
1498,85,夜のお仕事,？？・・・。本務機が戻ってくるまでの辛抱です。あとは修理代をどう捻出するかだ。「[PET_BOUNDARY]夜のお仕事[PET_BOUNDARY]」でもしなくちゃいけないかなあ？,夜のお仕事,0,？？・・・。本務機が戻ってくるまでの辛抱です。あとは修理代をどう捻出するかだ。「夜のお仕事」でもしなくちゃいけないかなあ？,sometimes
1499,85,夜のお仕事,ではなんとも珍しい「お茶漬け専門店」！大町の繁華街にあり、朝まで営業しているので[PET_BOUNDARY]夜のお仕事を[PET_BOUNDARY]終えた方や飲み終わった後に寄る人が多いお店です。カウンター席が１６席の小さなお,夜のお仕事を,0,ではなんとも珍しい「お茶漬け専門店」！大町の繁華街にあり、朝まで営業しているので夜のお仕事を終えた方や飲み終わった後に寄る人が多いお店です。カウンター席が１６席の小さなお,sometimes
1548,90,お遊び,う意義もないですし、恋愛相手の方へ行けば良いと思います。風俗はプロだから一時的な[PET_BOUNDARY]お遊びでしょうが[PET_BOUNDARY]、性感染症など病気が恐いです。エッチする人数が多いほど感染し易いですか,お遊びでしょうが,1,う意義もないですし、恋愛相手の方へ行けば良いと思います。風俗はプロだから一時的なお遊びでしょうが、性感染症など病気が恐いです。エッチする人数が多いほど感染し易いですか,sometimes
1549,90,お遊び,森進一の浮気にあるとおもいますが、浮気相手は誰でしょう。特定の人は知りませんが、[PET_BOUNDARY]お遊びが[PET_BOUNDARY]盛んなようですね。それに暴力では奥さんも良く今まで我慢してきたなと思います。奥,お遊びが,1,森進一の浮気にあるとおもいますが、浮気相手は誰でしょう。特定の人は知りませんが、お遊びが盛んなようですね。それに暴力では奥さんも良く今まで我慢してきたなと思います。奥,sometimes
1550,90,お遊び,を口にするたびに、私は、あることを思い出します。それは、幼なじみとの楽しい性的な[PET_BOUNDARY]お遊びの[PET_BOUNDARY]出来事です。 私には子どもの頃から一緒にお風呂に入ったり、プールに行ったりして,お遊びの,1,を口にするたびに、私は、あることを思い出します。それは、幼なじみとの楽しい性的なお遊びの出来事です。 私には子どもの頃から一緒にお風呂に入ったり、プールに行ったりして,sometimes
1551,90,お遊び,が大事なのかよ」 あれから原田も結婚し、子供が出来た。三歳になる娘が可愛く、夜の[PET_BOUNDARY]お遊びも[PET_BOUNDARY]ご無沙汰だったのだ。「だって、涼音ちゃんが待ってるからさあ」「ちぇっ、面白くね,お遊びも,1,が大事なのかよ」 あれから原田も結婚し、子供が出来た。三歳になる娘が可愛く、夜のお遊びもご無沙汰だったのだ。「だって、涼音ちゃんが待ってるからさあ」「ちぇっ、面白くね,sometimes
1552,90,お遊び,は２０年くらい前に一度ブームになった時、本を買ったことがありました。その時も半分[PET_BOUNDARY]お遊び[PET_BOUNDARY]感覚で読んでいましたが、あれだけ自信たっぷりに断定的な言い方をされたら、普通の人,お遊び,0,は２０年くらい前に一度ブームになった時、本を買ったことがありました。その時も半分お遊び感覚で読んでいましたが、あれだけ自信たっぷりに断定的な言い方をされたら、普通の人,sometimes
1553,90,お遊び,網走ＪＪ（ジャニーズＪｒ．ね）の人たちです。たぶんこのツアーの中だけで結成された[PET_BOUNDARY]お遊び的な[PET_BOUNDARY]グループかな？と思いますが、人気が出たら本当にデビューしたりして（笑）ちなみ,お遊び的な,0,網走ＪＪ（ジャニーズＪｒ．ね）の人たちです。たぶんこのツアーの中だけで結成されたお遊び的なグループかな？と思いますが、人気が出たら本当にデビューしたりして（笑）ちなみ,sometimes
1554,90,お遊び,悪い、あんずたん。（良くいえば、世渡り上手？）はい・・・・・結局この後、長い時間[PET_BOUNDARY]お遊びに[PET_BOUNDARY]付き合わされましたとさ （−。−）ｙ−゜゜゜その時、まろんさんは ↓『あたちに,お遊びに,0,悪い、あんずたん。（良くいえば、世渡り上手？）はい・・・・・結局この後、長い時間お遊びに付き合わされましたとさ （−。−）ｙ−゜゜゜その時、まろんさんは ↓『あたちに,sometimes
1555,90,お遊び,親らしい優しい心があろうとは三郎にも汲み取れぬからである。 「いゝお天気で…街へ[PET_BOUNDARY]お遊びですかい[PET_BOUNDARY]」と突然、挨拶してすれ違った者があるので、振り返ると、やはり街へ出ていた,お遊びですかい,0,親らしい優しい心があろうとは三郎にも汲み取れぬからである。 「いゝお天気で…街へお遊びですかい」と突然、挨拶してすれ違った者があるので、振り返ると、やはり街へ出ていた,sometimes
1556,90,お遊び,／その他＝絵本の読み聞かせや紙芝居、子育て・栄養相談も実施。小さなお子さん向けの[PET_BOUNDARY]お遊び[PET_BOUNDARY]コーナーもあります。問＝子育て支援課（☎８２９‐１２７０）秋の親子環境教室 〜里,お遊び,0,／その他＝絵本の読み聞かせや紙芝居、子育て・栄養相談も実施。小さなお子さん向けのお遊びコーナーもあります。問＝子育て支援課（☎８２９‐１２７０）秋の親子環境教室 〜里,sometimes
1557,90,お遊び,知つてゐる。けれども、それ等をば單に人の惡いなさり樣だとしか思つてゐない。どうせ[PET_BOUNDARY]お遊びに[PET_BOUNDARY]なる方は、家へいらつしやらなければ、他の家へ往つてお遊びになつてゐるのに違ひな,お遊びに,0,知つてゐる。けれども、それ等をば單に人の惡いなさり樣だとしか思つてゐない。どうせお遊びになる方は、家へいらつしやらなければ、他の家へ往つてお遊びになつてゐるのに違ひな,sometimes
1558,90,お遊び,知つてゐる。けれども、それ等をば單に人の惡いなさり樣だとしか思つてゐない。どうせお遊びになる方は、家へいらつしやらなければ、他の家へ往つて[PET_BOUNDARY]お遊びに[PET_BOUNDARY]なつてゐるのに違ひな,お遊びに,0,知つてゐる。けれども、それ等をば單に人の惡いなさり樣だとしか思つてゐない。どうせお遊びになる方は、家へいらつしやらなければ、他の家へ往つてお遊びになつてゐるのに違ひな,sometimes
1559,90,お遊び,くだん覚えたんだ、俺のマルノーム。まぁ後で久々にゲーム日記でも書くかなｗ今友達と[PET_BOUNDARY]お遊びで[PET_BOUNDARY]ゲームしてるんだｗそんじゃ日記ｗ今日は４教科↓↓↓塚今日の朝学活で席替えしたｗ,お遊びで,0,くだん覚えたんだ、俺のマルノーム。まぁ後で久々にゲーム日記でも書くかなｗ今友達とお遊びでゲームしてるんだｗそんじゃ日記ｗ今日は４教科↓↓↓塚今日の朝学活で席替えしたｗ,sometimes
1560,91,コンパニオン,名、僕を含めて男性が五名、女性三名、という割合である。ここに来るまで「ナレーター[PET_BOUNDARY]コンパニオンなんかを[PET_BOUNDARY]やっている、キャピキャピしたギャルがけっこう来るのでは…」と、仄かながら,コンパニオンなんかを,1,名、僕を含めて男性が五名、女性三名、という割合である。ここに来るまで「ナレーターコンパニオンなんかをやっている、キャピキャピしたギャルがけっこう来るのでは…」と、仄かながら,sometimes
1561,91,コンパニオン,よ！と言います。。。まず間違い無いと思います。風俗に行くかどうかは分からないけど[PET_BOUNDARY]コンパニオンぐらいは[PET_BOUNDARY]呼ぶでしょう。私も以前男ばかりの職場にいましたがコンパニオンは当たり前で,コンパニオンぐらいは,1,よ！と言います。。。まず間違い無いと思います。風俗に行くかどうかは分からないけどコンパニオンぐらいは呼ぶでしょう。私も以前男ばかりの職場にいましたがコンパニオンは当たり前で,sometimes
