row_id,PET_id,PET,expanded_text,span_text,label,whole_text,pet_type
492,33,運び屋,」と述べている。彼によれば、その七〇％がいわゆる“トリッピング”、つまり密造酒の[PET_BOUNDARY]運び屋を[PET_BOUNDARY]やっていて、おそらくちょいと酒造りもやっていたはずだという。ストックカー・レー,運び屋を,1,」と述べている。彼によれば、その七〇％がいわゆる“トリッピング”、つまり密造酒の運び屋をやっていて、おそらくちょいと酒造りもやっていたはずだという。ストックカー・レー,sometimes
493,33,運び屋,博者のことだ。「あなたはノミ屋が発砲したという話を聞いたことがありますか。麻薬の[PET_BOUNDARY]運び屋は[PET_BOUNDARY]撃ちます。だが車泥棒は撃ちません。なぜ撃たにゃならんのです？ 彼らに考えられる,運び屋は,1,博者のことだ。「あなたはノミ屋が発砲したという話を聞いたことがありますか。麻薬の運び屋は撃ちます。だが車泥棒は撃ちません。なぜ撃たにゃならんのです？ 彼らに考えられる,sometimes
494,33,運び屋,大変だ〜〜何故今になってバレタ？？これもまた、大変だ？ 福機長が。万引きの手先、[PET_BOUNDARY]運び屋を[PET_BOUNDARY]したとか？日本で万引きをした、化粧品を福機長が、運んだそうだ、主犯格は女とか・,運び屋を,1,大変だ〜〜何故今になってバレタ？？これもまた、大変だ？ 福機長が。万引きの手先、運び屋をしたとか？日本で万引きをした、化粧品を福機長が、運んだそうだ、主犯格は女とか・,sometimes
495,33,運び屋,酔って転落したのだと見たようだが、洋介は殺されたのだといっていた。彼女は…麻薬の[PET_BOUNDARY]運び屋の[PET_BOUNDARY]ような仕事もしていたらしい。その事件があって、洋介は自分も危いといいだした。私,運び屋の,1,酔って転落したのだと見たようだが、洋介は殺されたのだといっていた。彼女は…麻薬の運び屋のような仕事もしていたらしい。その事件があって、洋介は自分も危いといいだした。私,sometimes
496,33,運び屋,せたるのが商売」のエロ事師だった。 仲間は写真の撮影や変造を担当する伴的、ブツの[PET_BOUNDARY]運び屋[PET_BOUNDARY]ゴキの二人で、ブルーフィルムの自主制作第一号は男役なし、女一人の、題して「独楽」,運び屋,1,せたるのが商売」のエロ事師だった。 仲間は写真の撮影や変造を担当する伴的、ブツの運び屋ゴキの二人で、ブルーフィルムの自主制作第一号は男役なし、女一人の、題して「独楽」,sometimes
497,33,運び屋,網は東南アジアのほか、オランダなど欧州にも広がっていた。同通信によると、麻薬の「[PET_BOUNDARY]運び屋[PET_BOUNDARY]」は１回につき最高４万ドル（約４３６万円）程度を受け取っていたと見られる。シャン,運び屋,1,網は東南アジアのほか、オランダなど欧州にも広がっていた。同通信によると、麻薬の「運び屋」は１回につき最高４万ドル（約４３６万円）程度を受け取っていたと見られる。シャン,sometimes
498,33,運び屋,れとも、もっと疑うと、チェンもあの少左の部下だったのかもしれない。おれが、ただの[PET_BOUNDARY]運び屋か[PET_BOUNDARY]どうかを知るために、牢屋に潜りこませたのかも？ それなら、どうしておれと簡単に,運び屋か,1,れとも、もっと疑うと、チェンもあの少左の部下だったのかもしれない。おれが、ただの運び屋かどうかを知るために、牢屋に潜りこませたのかも？ それなら、どうしておれと簡単に,sometimes
499,33,運び屋,、若者らしい反逆心から、機密をソ連に売ろうとする。そして友人ドールトン（ペン）を[PET_BOUNDARY]運び屋に[PET_BOUNDARY]してＫＧＢと接触をはかる。５／１６水資金源強奪（７５年 東映）日本テレビ 深２,運び屋に,1,、若者らしい反逆心から、機密をソ連に売ろうとする。そして友人ドールトン（ペン）を運び屋にしてＫＧＢと接触をはかる。５／１６水資金源強奪（７５年 東映）日本テレビ 深２,sometimes
500,33,運び屋,ーズ）のテストパイロット。パルマー戦役中からパートナーのツグミ・タカクラとともに[PET_BOUNDARY]運び屋を[PET_BOUNDARY]営んでいたが、秘密裏に依頼された機動兵器輸送を契機に戦乱へと巻き込まれていく。,運び屋を,1,ーズ）のテストパイロット。パルマー戦役中からパートナーのツグミ・タカクラとともに運び屋を営んでいたが、秘密裏に依頼された機動兵器輸送を契機に戦乱へと巻き込まれていく。,sometimes
501,33,運び屋,。 「俺たちは、あんたのお陰でテストに落ちて命拾いをしたよ。三カ月前、クサダシで[PET_BOUNDARY]運び屋が[PET_BOUNDARY]つかまって、俺たちのあと釜に坐った連中はアラブ人の組織に殺された。七人が自動小,運び屋が,1,。 「俺たちは、あんたのお陰でテストに落ちて命拾いをしたよ。三カ月前、クサダシで運び屋がつかまって、俺たちのあと釜に坐った連中はアラブ人の組織に殺された。七人が自動小,sometimes
502,33,運び屋,家その者ではない。Ｘが話す（話に相応する出来事が映像に現れる）：パリ北駅で麻薬の[PET_BOUNDARY]運び屋[PET_BOUNDARY]Ｃが共犯者Ａからベルギーへ麻薬を運搬する二重底の鞄（黒い）を受け取り、アントワー,運び屋,1,家その者ではない。Ｘが話す（話に相応する出来事が映像に現れる）：パリ北駅で麻薬の運び屋Ｃが共犯者Ａからベルギーへ麻薬を運搬する二重底の鞄（黒い）を受け取り、アントワー,sometimes
503,33,運び屋,四九年のシリーズで優勝）、やがてグランド・ナショナルで活躍することになる。彼は、[PET_BOUNDARY]運び屋だった[PET_BOUNDARY]頃、わざとパトカーをおびき寄せて、追跡劇をしたと自慢している。運転技術に加,運び屋だった,1,四九年のシリーズで優勝）、やがてグランド・ナショナルで活躍することになる。彼は、運び屋だった頃、わざとパトカーをおびき寄せて、追跡劇をしたと自慢している。運転技術に加,sometimes
504,33,運び屋,母人工染色体」（ＹＡＣ）のように、いくつかのＤＮＡをつなぎ合わせてつくった人工の[PET_BOUNDARY]運び屋も[PET_BOUNDARY]あります。図１１‐４ レトロウイルスの生活（生田哲，１９９７より改変）,運び屋も,0,母人工染色体」（ＹＡＣ）のように、いくつかのＤＮＡをつなぎ合わせてつくった人工の運び屋もあります。図１１‐４ レトロウイルスの生活（生田哲，１９９７より改変）,sometimes
505,33,運び屋,一名の小さな小学校へ赴任した時のことである。小さな学校の校長は、事務会議、教材の[PET_BOUNDARY]運び屋[PET_BOUNDARY]、用務員の仕事など多忙である。 しかし、子供から離れては教育者でないという思いか,運び屋,0,一名の小さな小学校へ赴任した時のことである。小さな学校の校長は、事務会議、教材の運び屋、用務員の仕事など多忙である。 しかし、子供から離れては教育者でないという思いか,sometimes
506,33,運び屋,感染はない。あまり神経質になる必要はないが、問題は侵入経路である ▼ウイルスの「[PET_BOUNDARY]運び屋[PET_BOUNDARY]」として野鳥が疑われている。事実とすれば〈きょうからは日本の雁ぞ楽に寝よ〉と、小,運び屋,0,感染はない。あまり神経質になる必要はないが、問題は侵入経路である ▼ウイルスの「運び屋」として野鳥が疑われている。事実とすれば〈きょうからは日本の雁ぞ楽に寝よ〉と、小,sometimes
507,33,運び屋,工的に切り開いて、その間に目的のＤＮＡをはさみ込むと、それがそのまま、ＤＮＡの“[PET_BOUNDARY]運び屋[PET_BOUNDARY]”（ベクター）になり、宛先の細胞にＤＮＡを運んでくれます。新しい下宿で自身が分裂,運び屋,0,工的に切り開いて、その間に目的のＤＮＡをはさみ込むと、それがそのまま、ＤＮＡの“運び屋”（ベクター）になり、宛先の細胞にＤＮＡを運んでくれます。新しい下宿で自身が分裂,sometimes
508,33,運び屋,いインフルエンザにかかったろう？ あのとき、きみがずいぶんせわをしたよね。ぼくは[PET_BOUNDARY]運び屋だったから[PET_BOUNDARY]、知っているけど」 「でも、あれからずっときげん悪かった。よけいなこと,運び屋だったから,0,いインフルエンザにかかったろう？ あのとき、きみがずいぶんせわをしたよね。ぼくは運び屋だったから、知っているけど」 「でも、あれからずっときげん悪かった。よけいなこと,sometimes
509,33,運び屋,を増殖して多量に取り出すことが可能になります。 ファージＤＮＡはヒトの遺伝子の「[PET_BOUNDARY]運び屋[PET_BOUNDARY]」として用いられるわけで、組換えの用語で「ベクター」と呼びます。また、ヒトの全遺,運び屋,0,を増殖して多量に取り出すことが可能になります。 ファージＤＮＡはヒトの遺伝子の「運び屋」として用いられるわけで、組換えの用語で「ベクター」と呼びます。また、ヒトの全遺,sometimes
510,33,運び屋,は、業界誌『ジャパン・ポスト』の久保俊広社長や日大芸術学部の伊大知昭司助教授が“[PET_BOUNDARY]運び屋[PET_BOUNDARY]”として働いていたというより、二人で分配し合った、ということが真相らしいですね。,運び屋,0,は、業界誌『ジャパン・ポスト』の久保俊広社長や日大芸術学部の伊大知昭司助教授が“運び屋”として働いていたというより、二人で分配し合った、ということが真相らしいですね。,sometimes
511,33,運び屋,いる。 昆虫ばかりではない。生物の活動の中心が夜にある熱帯では、コウモリが花粉の[PET_BOUNDARY]運び屋と[PET_BOUNDARY]して大活躍する。たとえば、南アフリカ産のバオバブのようにコウモリに花粉の媒介を,運び屋と,0,いる。 昆虫ばかりではない。生物の活動の中心が夜にある熱帯では、コウモリが花粉の運び屋として大活躍する。たとえば、南アフリカ産のバオバブのようにコウモリに花粉の媒介を,sometimes
512,33,運び屋,ては、ウイルスやプラスミドなどがよく用いられる。 ウイルスはその感染力を利用して[PET_BOUNDARY]運び屋と[PET_BOUNDARY]して選ばれる。プラスミドは、細菌のような原核細胞の中にあり、細菌のゲノムＤＮＡ,運び屋と,0,ては、ウイルスやプラスミドなどがよく用いられる。 ウイルスはその感染力を利用して運び屋として選ばれる。プラスミドは、細菌のような原核細胞の中にあり、細菌のゲノムＤＮＡ,sometimes
513,33,運び屋,ょう。 生物はそれぞれの種に特有な核型というものをもっています。核型とは遺伝子の[PET_BOUNDARY]運び屋で[PET_BOUNDARY]ある染色体の数，大きさ，形，縞模様をまとめて示したものです。言葉で説明するより,運び屋で,0,ょう。 生物はそれぞれの種に特有な核型というものをもっています。核型とは遺伝子の運び屋である染色体の数，大きさ，形，縞模様をまとめて示したものです。言葉で説明するより,sometimes
514,33,運び屋,くれる。白い蛍光ランプの光が強烈で、まぶしいくらいである。 「組み換えの手法は、[PET_BOUNDARY]運び屋で[PET_BOUNDARY]あるアグロバクテリウムを使う方法と、パーティクルガンを使う方法と二種類です。遺,運び屋で,0,くれる。白い蛍光ランプの光が強烈で、まぶしいくらいである。 「組み換えの手法は、運び屋であるアグロバクテリウムを使う方法と、パーティクルガンを使う方法と二種類です。遺,sometimes
515,33,運び屋,らうことができ、バイオテクノロジーにとってはなくてはならない存在です。 ＤＮＡの[PET_BOUNDARY]運び屋と[PET_BOUNDARY]しては、このほかのウイルスや、特殊な細菌も利用されていて（第１３章参照）、なか,運び屋と,0,らうことができ、バイオテクノロジーにとってはなくてはならない存在です。 ＤＮＡの運び屋としては、このほかのウイルスや、特殊な細菌も利用されていて（第１３章参照）、なか,sometimes
516,33,運び屋,込まれた細胞が体内で増殖し、がん細胞を攻撃して抑制するのです。ウイルスが遺伝子の[PET_BOUNDARY]運び屋と[PET_BOUNDARY]なってｐ５３を細胞内に補給するというわけです。 まだがん細胞だけにｐ５３を効率,運び屋と,0,込まれた細胞が体内で増殖し、がん細胞を攻撃して抑制するのです。ウイルスが遺伝子の運び屋となってｐ５３を細胞内に補給するというわけです。 まだがん細胞だけにｐ５３を効率,sometimes
544,35,白い粉,隠されている。冴子は小さな紙にくるまれたその包みをそっと取りだして、中を開いた。[PET_BOUNDARY]白い粉が[PET_BOUNDARY]ビニール袋に入っていた。 「何、これ覚醒剤？…どうして、こんなものが」 偶然、,白い粉が,1,隠されている。冴子は小さな紙にくるまれたその包みをそっと取りだして、中を開いた。白い粉がビニール袋に入っていた。 「何、これ覚醒剤？…どうして、こんなものが」 偶然、,sometimes
545,35,白い粉,た新宿のビル火災や、殺人、強盗など凶悪犯罪が続発。米国の同時テロ後は、都内でも「[PET_BOUNDARY]白い粉[PET_BOUNDARY]騒ぎ」が続くなど、「安全」に対する信頼の揺らぎが目立つ一年だった。■凶悪事件 世,白い粉,1,た新宿のビル火災や、殺人、強盗など凶悪犯罪が続発。米国の同時テロ後は、都内でも「白い粉騒ぎ」が続くなど、「安全」に対する信頼の揺らぎが目立つ一年だった。■凶悪事件 世,sometimes
546,35,白い粉,物乱用を拒絶する社会環境づくりを推進している。元年には，薬物乱用体験者の手記集「[PET_BOUNDARY]白い粉の[PET_BOUNDARY]恐怖」（１０万部），指導者用テキスト「心と身体と薬物」，「少年の環境と行動」等,白い粉の,1,物乱用を拒絶する社会環境づくりを推進している。元年には，薬物乱用体験者の手記集「白い粉の恐怖」（１０万部），指導者用テキスト「心と身体と薬物」，「少年の環境と行動」等,sometimes
547,35,白い粉,るぜ」 フェデリコは小型トランクに走り寄り、トランクを開けた。ビニール袋に入った[PET_BOUNDARY]白い粉を[PET_BOUNDARY]見せた。隣りのボストン・バッグも開けた。中には緑色のドル紙幣の束がぎっしりと詰,白い粉を,1,るぜ」 フェデリコは小型トランクに走り寄り、トランクを開けた。ビニール袋に入った白い粉を見せた。隣りのボストン・バッグも開けた。中には緑色のドル紙幣の束がぎっしりと詰,sometimes
548,35,白い粉,をのり出して、それを手に取った。「ええ」 「あけてごらん」 彼女はふたをあけた。[PET_BOUNDARY]白い粉の[PET_BOUNDARY]上に、銀のコカイン用スプーンがのっていた。 「最高のものだ。最高に純度が高い。,白い粉の,1,をのり出して、それを手に取った。「ええ」 「あけてごらん」 彼女はふたをあけた。白い粉の上に、銀のコカイン用スプーンがのっていた。 「最高のものだ。最高に純度が高い。,sometimes
549,35,白い粉,するような物音が聞こえた。 真行寺は手すりに駆け寄り、下を見た。トランクが裂けて[PET_BOUNDARY]白い粉が[PET_BOUNDARY]散乱していた。その粉を被って、ルシアの体が見えた。白い粉にみるみるうちに赤い血,白い粉が,0,するような物音が聞こえた。 真行寺は手すりに駆け寄り、下を見た。トランクが裂けて白い粉が散乱していた。その粉を被って、ルシアの体が見えた。白い粉にみるみるうちに赤い血,sometimes
550,35,白い粉,するような物音が聞こえた。 真行寺は手すりに駆け寄り、下を見た。トランクが裂けて白い粉が散乱していた。その粉を被って、ルシアの体が見えた。[PET_BOUNDARY]白い粉に[PET_BOUNDARY]みるみるうちに赤い血,白い粉に,0,するような物音が聞こえた。 真行寺は手すりに駆け寄り、下を見た。トランクが裂けて白い粉が散乱していた。その粉を被って、ルシアの体が見えた。白い粉にみるみるうちに赤い血,sometimes
551,35,白い粉,先日足のくさい上司がお得意様になにやら通販で購入したと言う怪しい[PET_BOUNDARY]白い粉を[PET_BOUNDARY]靴に振り掛けていました、１週間後何と足しくさ部長の足が臭くないのです。この白い,白い粉を,0,先日足のくさい上司がお得意様になにやら通販で購入したと言う怪しい白い粉を靴に振り掛けていました、１週間後何と足しくさ部長の足が臭くないのです。この白い,sometimes
552,35,白い粉,。 私はそれを無視して、腰に下げていた手錠を組員の右手首にかけ、分室に連行した。[PET_BOUNDARY]白い粉が[PET_BOUNDARY]覚せい剤であったことは言うまでもない。だが、組員は取調べにも、所持していた覚せ,白い粉が,1,。 私はそれを無視して、腰に下げていた手錠を組員の右手首にかけ、分室に連行した。白い粉が覚せい剤であったことは言うまでもない。だが、組員は取調べにも、所持していた覚せ,sometimes
553,35,白い粉,おう。酒びたりになるのでもベッドのシーツにもぐりこむのでもなく、注射針を刺したり[PET_BOUNDARY]白い粉を[PET_BOUNDARY]なめたりするのでもない、狂気の中へ。自分自身の棚の上に、自分自身のたるきの中に,白い粉を,1,おう。酒びたりになるのでもベッドのシーツにもぐりこむのでもなく、注射針を刺したり白い粉をなめたりするのでもない、狂気の中へ。自分自身の棚の上に、自分自身のたるきの中に,sometimes
554,35,白い粉,「まさか、俊也さんが…」 俊也が覚醒剤を使用したという疑いは百パーセントないが、[PET_BOUNDARY]白い粉が[PET_BOUNDARY]ここにある以上、全く無関係だとは断言できない。 警察は俊也の死を事故だと断定し,白い粉が,1,「まさか、俊也さんが…」 俊也が覚醒剤を使用したという疑いは百パーセントないが、白い粉がここにある以上、全く無関係だとは断言できない。 警察は俊也の死を事故だと断定し,sometimes
555,35,白い粉,。私は何もしていませんよ」 組員は不服そうに言った。そして、背広のポケットから、[PET_BOUNDARY]白い粉の[PET_BOUNDARY]入っているビニールの袋を取り出し、 「この件で協力するために、分室（横浜）に行,白い粉の,1,。私は何もしていませんよ」 組員は不服そうに言った。そして、背広のポケットから、白い粉の入っているビニールの袋を取り出し、 「この件で協力するために、分室（横浜）に行,sometimes
556,35,白い粉,す。ケンネルコッフにかかってるようで咳が止まりません。病院にはいってるのですが（[PET_BOUNDARY]白い粉薬は[PET_BOUNDARY]飲ませています）何か治療できるものは無いでしょうか？もう１か月くらいになりま,白い粉薬は,0,す。ケンネルコッフにかかってるようで咳が止まりません。病院にはいってるのですが（白い粉薬は飲ませています）何か治療できるものは無いでしょうか？もう１か月くらいになりま,sometimes
557,35,白い粉,後石灰を撒きます。海苔などについている乾燥剤を湿気の多いところにほっぽっておくと[PET_BOUNDARY]白い粉[PET_BOUNDARY]（生石灰）になるので使えます。熱い茹で汁を雑草にかけます。”そうめん””菜っ葉”,白い粉,0,後石灰を撒きます。海苔などについている乾燥剤を湿気の多いところにほっぽっておくと白い粉（生石灰）になるので使えます。熱い茹で汁を雑草にかけます。”そうめん””菜っ葉”,sometimes
558,35,白い粉,９００円から１０００円だった気がします。でもあれよくないよ！！プッシュすると脇に[PET_BOUNDARY]白い粉が[PET_BOUNDARY]ついちゃうもん！,白い粉が,0,９００円から１０００円だった気がします。でもあれよくないよ！！プッシュすると脇に白い粉がついちゃうもん！,sometimes
559,35,白い粉,が空を覆い、先頭を行く葛城稚犬養連網田が松明をつけて進んだ。明かりの周辺に小雪が[PET_BOUNDARY]白い粉と[PET_BOUNDARY]なって光り煌いた。凍りつくよう寒さだが、馬に乗った吾は昂奮のせいか身体が燃え、,白い粉と,0,が空を覆い、先頭を行く葛城稚犬養連網田が松明をつけて進んだ。明かりの周辺に小雪が白い粉となって光り煌いた。凍りつくよう寒さだが、馬に乗った吾は昂奮のせいか身体が燃え、,sometimes
560,35,白い粉,種殻をのせ、コークスで焼くようになっている。 どうしてコークスで焼くとあの貝殻が[PET_BOUNDARY]白い粉に[PET_BOUNDARY]なってしまうのかわからなくて、折角だからあちこち一所懸命に眺めて回ったのだけれ,白い粉に,0,種殻をのせ、コークスで焼くようになっている。 どうしてコークスで焼くとあの貝殻が白い粉になってしまうのかわからなくて、折角だからあちこち一所懸命に眺めて回ったのだけれ,sometimes
561,35,白い粉,ウ。巨峰果汁が多く、甘みが強いのが特徴。果皮と果肉が離れやすく食べやすい。果粒に[PET_BOUNDARY]白い粉が[PET_BOUNDARY]出ているのはブルームといい、ブドウの内部より分泌される保護膜で、白くついている,白い粉が,0,ウ。巨峰果汁が多く、甘みが強いのが特徴。果皮と果肉が離れやすく食べやすい。果粒に白い粉が出ているのはブルームといい、ブドウの内部より分泌される保護膜で、白くついている,sometimes
562,35,白い粉,ん期待を裏切る奴だ。俺の期待を二回も裏切った小谷信太はチョークをおっさんに返し、[PET_BOUNDARY]白い粉の[PET_BOUNDARY]付いた指を左の掌に押しつけて拭くと、何があるのか知らないが少し斜め上を見たり、,白い粉の,0,ん期待を裏切る奴だ。俺の期待を二回も裏切った小谷信太はチョークをおっさんに返し、白い粉の付いた指を左の掌に押しつけて拭くと、何があるのか知らないが少し斜め上を見たり、,sometimes
563,35,白い粉,向かって吹き下ろしてくる。どこもかしこも乾燥し、ぼくらの身体も、肌がカサカサして[PET_BOUNDARY]白い粉を[PET_BOUNDARY]ふき、唇がパリパリになってひび割れた。すると、毎朝、母さんたちは油を腕や足に擦,白い粉を,0,向かって吹き下ろしてくる。どこもかしこも乾燥し、ぼくらの身体も、肌がカサカサして白い粉をふき、唇がパリパリになってひび割れた。すると、毎朝、母さんたちは油を腕や足に擦,sometimes
564,35,白い粉,かったのもつかの間、しばらくして、冷めてしまった大学イモの飴が砂糖の結晶した様な[PET_BOUNDARY]白い粉っぽい[PET_BOUNDARY]物になってしまいました。飴が砂糖に戻りかけて仕舞ったのでしょう。飴が安定し,白い粉っぽい,0,かったのもつかの間、しばらくして、冷めてしまった大学イモの飴が砂糖の結晶した様な白い粉っぽい物になってしまいました。飴が砂糖に戻りかけて仕舞ったのでしょう。飴が安定し,sometimes
